"url","title","keyword","slug","description","intro","cta","bullets","tags","examples","tips_do","tips_avoid","h2a_title","h2a_text","h2b_title","h2b_text","h2c_title","h2c_text","faq1_q","faq1_a","faq2_q","faq2_a","faq3_q","faq3_a","internal_links"
"/chat/letnii-flirt-18-bot/","Летний флирт 18+ — бот","летний флирт 18+ бот","letnii-flirt-18-bot","Солнечный, лёгкий 18+ флирт в тексте — без подробностей и медиа.","Нужен летний вайб? Делаем всё деликатно.","Открыть 18+ чат в Telegram","Тёплый тон|Намёки|Текст","18+|лето|флирт|бот","Чуть летнего настроения?|Пара намёков без деталей?|Если лишнее — остановимся.","Согласовывать тон|Паузы|Приватность","Не просить медиа|Не грубить|Не давить","Как это работает","Текстовые ответы с лёгким летним настроением.","Границы и безопасность","Строго 18+, без графики.","Идеи для 18+ беседы","Пляж, парк, музыка.","Нужно подтверждать возраст?","Да, 18+.","Есть ли откровенный контент?","Нет, только текст.","Анонимность и безопасность?","Берегите данные.",""
"/chat/muzyka-18-flirt-bot/","Музыка и флирт 18+ — бот","музыка и флирт 18+ бот","muzyka-18-flirt-bot","Обсуждение музыки с ноткой 18+ флирта — без медиа и резкости.","Любите музыку? Соединяем вкусы и тёплые намёки.","Открыть 18+ чат в Telegram","Общие интересы|Намёки|Текст","18+|музыка|флирт|бот","Обсудим плейлист и пару намёков?|Очень мягко, без подробностей?|Если что — остановимся.","Согласовывать тон|Бережность|Паузы","Не спорить резко|Не просить медиа|Не давить","Как это работает","Текстовый диалог о треках с аккуратным флиртом.","Границы и безопасность","18+, без графики, приватно.","Идеи для 18+ беседы","Концерты, ассоциации, настроение.","Нужно подтверждать возраст?","Да, 18+.","Есть ли откровенный контент?","Нет, текст.","Анонимность и безопасность?","Соблюдайте приватность.",""
"/chat/kino-18-idei-bot/","Идеи для кино-вечера 18+ — бот","идеи кино вечер 18+ бот","kino-18-idei-bot","Подкидывает темы и реплики для 18+ кино-вечера — без медиа.","Готовите кино-вечер? Берите деликатные подсказки.","Открыть 18+ чат в Telegram","Подсказки тем|Текст|Намёки","18+|кино|вечер|бот","Идея для фразы под фильм?|Пара комплиментов к пледу?|Если лишнее — стоп.","Согласовывать ожидания|Бережность|Паузы","Не просить медиа|Не навязывать|Без грубости","Как это работает","Короткие текстовые подсказки для вечера.","Границы и безопасность","Приватно, 18+, корректно.","Идеи для 18+ беседы","Фильм, эмоции, намёки.","Нужно подтверждать возраст?","Да, 18+.","Есть ли откровенный контент?","Нет, только текст.","Анонимность и безопасность?","Берегите личное.",""
"/chat/igry-komplimentov-18-bot/","Игра комплиментов 18+ — бот","игра комплиментов 18+ бот","igry-komplimentov-18-bot","Мини-игра 18+ на красивых комплиментах — всё в тексте.","Хотите обменяться тёплыми фразами? Попробуем.","Открыть 18+ чат в Telegram","Комплименты|Текст|Намёки","18+|комплименты|игра|бот","Обменяемся комплиментами 18+?|Очень деликатно?|Если что — остановимся.","Деликатность|Паузы|Приватность","Не переходить границы|Не давить|Без грубости","Как это работает","Вы даёте комплимент — бот подсказывает ответ.","Границы и безопасность","18+, без графики.","Идеи для 18+ беседы","Внешность, манеры, настроение — аккуратно.","Нужно подтверждать возраст?","Да, 18+.","Есть ли откровенный контент?","Нет, текст.","Анонимность и безопасность?","Соблюдайте приватность.",""
"/chat/medlennyi-flirt-18-bot/","Медленный флирт 18+ — бот","медленный флирт 18+ бот","medlennyi-flirt-18-bot","Формат «slow burn»: 18+ намёки, паузы, уважительный тон — без медиа.","Любите постепенность? Возьмём мягкий ритм.","Открыть 18+ чат в Telegram","Slow burn|Текст|Намёки","18+|медленный флирт|бот|деликатно","Давай очень медленно и аккуратно?|Паузы и полутона — ок?|Если лишнее — остановимся.","Согласовывать ритм|Паузы|Приватность","Не торопить|Не просить медиа|Без резкости","Как это работает","Плавное развитие сцены в тексте.","Границы и безопасность","18+, анонимно, без графики.","Идеи для 18+ беседы","Сцены свидания, переписка дня.","Нужно подтверждать возраст?","Да, 18+.","Есть ли откровенный контент?","Нет, текст.","Анонимность и безопасность?","Берегите данные.",""
"/chat/bystryj-flirt-18-bot/","Быстрый флирт 18+ — бот","быстрый флирт 18+ бот","bystryj-flirt-18-bot","Короткие и игривые 18+ сообщения — только текст, без подробностей.","Нужен бодрый ритм? Пробуем аккуратно и вежливо.","Открыть 18+ чат в Telegram","Короткие фразы|Намёки|Текст","18+|быстрый|флирт|бот","Несколько быстрых фраз 18+?|Без подробностей — ок?|Если перебор — скажи.","Согласовывать границы|Быть вежливым|Паузы","Не давить|Не просить медиа|Без грубости","Как это работает","Идеи для коротких 18+ реплик.","Границы и безопасность","Приватно, без графики.","Идеи для 18+ беседы","Комплименты, игра слов, роли.","Нужно подтверждать возраст?","Да, 18+.","Есть ли откровенный контент?","Нет, текст.","Анонимность и безопасность?","Соблюдайте приватность.",""
"/chat/opros-zhelanii-18-bot/","Опрос желаний 18+ — бот","опрос желаний 18+ бот","opros-zhelanii-18-bot","Аккуратный опрос желаний 18+ в тексте — без медиа и давления.","Хотите согласовать рамки? Используйте безопасные вопросы.","Открыть 18+ чат в Telegram","Согласование|Текст|Намёки","18+|опрос|желания|бот","Сформулируем границы 18+?|Что комфортно, а что нет?|Если что — пауза.","Спрашивать о комфорте|Фиксировать рамки|Паузы","Не нарушать границы|Не давить|Не просить медиа","Как это работает","Короткие вопросы помогают договориться.","Границы и безопасность","18+, приватно, уважительно.","Идеи для 18+ беседы","Роли, темп, тематики.","Нужно подтверждать возраст?","Да, 18+.","Есть ли откровенный контент?","Нет, только текст.","Анонимность и безопасность?","Не делитесь личным.",""
"/chat/smyslovye-igry-18-bot/","Смысловые игры 18+ — бот","смысловые игры 18+ бот","smyslovye-igry-18-bot","Играем полутонами и ассоциациями 18+ — без графики.","Хотите подтекст? Попробуйте ассоциативные подсказки.","Открыть 18+ чат в Telegram","Ассоциации|Намёки|Текст","18+|игры|ассоциации|бот","Игра в ассоциации 18+?|Только полутона и намёки?|Если лишнее — стоп.","Согласовывать стиль|Деликатность|Паузы","Не просить медиа|Не давить|Без грубости","Как это работает","Ассоциативные реплики заменяют подробности.","Границы и безопасность","Приватно, 18+, корректно.","Идеи для 18+ беседы","Сцены-впечатления, музыка, места.","Нужно подтверждать возраст?","Да, 18+.","Есть ли откровенный контент?","Нет, текст.","Анонимность и безопасность?","Соблюдайте приватность.",""
"/chat/smsy-18-sczenarii-bot/","Сценарии 18+ для СМС — бот","сценарии 18+ для смс бот","smsy-18-sczenarii-bot","Готовые шаблоны 18+ сообщений — деликатно и без пошлости.","Нужны идеи для СМС? Возьмите мягкие фразы.","Открыть 18+ чат в Telegram","Шаблоны|Текст|Деликатность","18+|смс|сценарии|бот","Дай СМС-фразу 18+ без деталей?|Ещё один вариант мягче?|Если что — остановимся.","Согласовывать тон|Паузы|Приватность","Не переходить границы|Не просить медиа|Без давления","Как это работает","Готовые подсказки под разные ситуации.","Границы и безопасность","18+, без графики.","Идеи для 18+ беседы","Свидания, планы, признания.","Нужно подтверждать возраст?","Да, 18+.","Есть ли откровенный контент?","Нет, только текст.","Анонимность и безопасность?","Берегите личное.",""
"/chat/bez-mata-18-bot/","18+ без мата — бот","18+ без мата бот","bez-mata-18-bot","Взрослый диалог без мата и пошлости — исключительно текст и намёки.","Предпочитаете чистый язык? Это ваш формат.","Открыть 18+ чат в Telegram","Корректный стиль|Текст|Намёки","18+|без мата|бот|деликатно","Говорим без мата и деталей — ок?|Пару аккуратных намёков?|Если лишнее — стоп.","Соблюдать стиль|Деликатность|Паузы","Не грубить|Не просить медиа|Не давить","Как это работает","Формулировки отбираются на корректность.","Границы и безопасность","Строго 18+, без графики.","Идеи для 18+ беседы","Комплименты, сцены, признания.","Нужно подтверждать возраст?","Да, 18+.","Есть ли откровенный контент?","Нет, только текст.","Анонимность и безопасность?","Соблюдайте приватность.",""
"/chat/v-doroge-18-bot/","В дороге 18+ — бот","в дороге 18+ бот","v-doroge-18-bot","Короткие 18+ сообщения для поездок — без медиа и без спешки.","Едете и нужен лёгкий диалог? Поддержим.","Открыть 18+ чат в Telegram","Коротко|Намёки|Текст","18+|дорога|бот|деликатно","Пара фраз в пути?|Очень деликатно?|Если некомфортно — стоп.","Согласовывать ритм|Паузы|Приватность","Не просить медиа|Не давить|Без грубости","Как это работает","Лаконичные подсказки под дорожный ритм.","Границы и безопасность","18+, без графики.","Идеи для 18+ беседы","Музыка, планы, комплименты.","Нужно подтверждать возраст?","Да, 18+.","Есть ли откровенный контент?","Нет, текст.","Анонимность и безопасность?","Берегите данные.",""
"/chat/dlya-introvertov-18-bot/","Для интровертов 18+ — бот","для интровертов 18+ бот","dlya-introvertov-18-bot","Ровный 18+ формат для тех, кто любит писать редко и по делу.","Предпочитаете минимум слов? Этот режим для вас.","Открыть 18+ чат в Telegram","Мини-сообщения|Намёки|Приватно","18+|интроверты|бот|деликатно","Можно коротко и нечасто?|Давай медленно и мягко?|Если что — пауза.","Согласовывать темп|Паузы|Деликатность","Не давить|Не просить медиа|Без грубости","Как это работает","Короткие, бережные 18+ реплики.","Границы и безопасность","Приватно, без графики.","Идеи для 18+ беседы","Комплименты, роли, планы.","Нужно подтверждать возраст?","Да, 18+.","Есть ли откровенный контент?","Нет, только текст.","Анонимность и безопасность?","Соблюдайте приватность.",""
"/chat/zagadochnaya-neznakomka-18-bot/","Загадочная незнакомка 18+ — бот","загадочная незнакомка 18+ бот","zagadochnaya-neznakomka-18-bot","Образ «загадочной незнакомки» в тексте: интрига и полутона — без медиа.","Хотите тайну и игру? Попробуем аккуратно.","Открыть 18+ чат в Telegram","Интрига|Намёки|Текст","18+|образ|интрига|бот","Сыграешь незнакомку в переписке?|Деликатные намёки вместо подробностей?|Если лишнее — стоп.","Согласовывать рамки|Бережность|Паузы","Не просить медиа|Не давить|Без грубости","Как это работает","Текстовый ролевой образ 18+.","Границы и безопасность","Приватно, 18+, без графики.","Идеи для 18+ беседы","Встреча, взгляды, признания.","Нужно подтверждать возраст?","Да, 18+.","Есть ли откровенный контент?","Нет, текст.","Анонимность и безопасность?","Берегите данные.",""
"/chat/sosedka-18-bot/","Соседка 18+ — бот","соседка 18+ бот","sosedka-18-bot","Образ взрослой соседки в деликатной 18+ переписке — без медиа.","Нужна лёгкая бытовая стилизация? Всё корректно.","Открыть 18+ чат в Telegram","Стилизация|Текст|Намёки","18+|соседка|образ|бот","Сцена случайной встречи у подъезда?|Пара мягких намёков?|Если что — притормозим.","Согласовывать рамки|Деликатность|Паузы","Не просить медиа|Не давить|Без грубости","Как это работает","Текстовый сценарий «соседка 18+».","Границы и безопасность","Без графики, приватно.","Идеи для 18+ беседы","Комплименты, помощь, планы.","Нужно подтверждать возраст?","Да, 18+.","Есть ли откровенный контент?","Нет, лишь текст.","Анонимность и безопасность?","Соблюдайте приватность.",""
"/chat/aktrisa-18-bot/","Актриса 18+ — творческая переписка","актриса 18+ бот","aktrisa-18-bot","Творческий образ «актрисы» в 18+ тексте — без медиа и грубости.","Хотите артистичную игру? Попробуем мягко.","Открыть 18+ чат в Telegram","Творческая стилизация|Текст|Намёки","18+|актриса|образ|бот","Сцена репетиции словами?|Чуть флирта и комплиментов?|Если лишнее — остановимся.","Согласовывать сюжет|Деликатность|Паузы","Не просить медиа|Не давить|Без грубости","Как это работает","Ролевой диалог в творческой стилистике.","Границы и безопасность","Строго 18+, приватно.","Идеи для 18+ беседы","Роли, сцены, аплодисменты.","Нужно подтверждать возраст?","Да, 18+.","Есть ли откровенный контент?","Нет, только текст.","Анонимность и безопасность?","Берегите личное.",""
"/chat/sportsmenka-18-bot/","Спортсменка 18+ — бодрый флирт","спортсменка 18+ бот","sportsmenka-18-bot","Бодрый, но уважительный 18+ тон: без медиа и без пошлости.","Нравится активный вайб? Поддержим в тексте.","Открыть 18+ чат в Telegram","Бодрый ритм|Намёки|Текст","18+|спорт|флирт|бот","Пару бодрых комплиментов?|Без подробностей, корректно?|Если что — стоп.","Согласовывать темп|Бережность|Паузы","Не просить медиа|Не давить|Без грубости","Как это работает","Живые, но деликатные 18+ ответы.","Границы и безопасность","Приватно, без графики.","Идеи для 18+ беседы","Тренировки, планы, свидания.","Нужно подтверждать возраст?","Да, 18+.","Есть ли откровенный контент?","Нет, текст.","Анонимность и безопасность?","Соблюдайте приватность.",""
"/chat/umnaya-sobesednica-18-bot/","Умная собеседница 18+ — бот","умная собеседница 18+ бот","umnaya-sobesednica-18-bot","Вдумчивый 18+ диалог без медиа: такт, намёки, уважение.","Нужна интеллектуальная искра? Попробуем.","Открыть 18+ чат в Telegram","Вдумчиво|Намёки|Текст","18+|умная|собеседница|бот","Пара тонких комплиментов уму и стилю?|Без подробностей — ок?|Если лишнее — остановимся.","Согласовывать тон|Паузы|Приватность","Не спорить жёстко|Не просить медиа|Не давить","Как это работает","Спокойный, осмысленный 18+ диалог.","Границы и безопасность","18+, без графики.","Идеи для 18+ беседы","Книги, кино, сцены-впечатления.","Нужно подтверждать возраст?","Да, 18+.","Есть ли откровенный контент?","Нет, лишь текст.","Анонимность и безопасность?","Берегите данные.",""
"/chat/aristokratichnyi-flirt-18-bot/","Аристократичный флирт 18+ — бот","аристократичный флирт 18+ бот","aristokratichnyi-flirt-18-bot","Немного аристократической манеры: деликатный 18+ флирт, без медиа.","Хотите благородный стиль? Попробуйте.","Открыть 18+ чат в Telegram","Благородные фразы|Намёки|Текст","18+|аристократичный|флирт|бот","Сдержанные комплименты 18+?|Тонко и вежливо, без деталей?|Если что — пауза.","Согласовывать стиль|Деликатность|Паузы","Не просить медиа|Не грубить|Не давить","Как это работает","Сдержанные, вежливые тексты 18+.","Границы и безопасность","Строго 18+, приватно.","Идеи для 18+ беседы","Бал, ужин, прогулка.","Нужно подтверждать возраст?","Да, 18+.","Есть ли откровенный контент?","Нет, текст.","Анонимность и безопасность?","Соблюдайте приватность.",""
"/chat/zagorodnyi-vecher-18-bot/","Загородный вечер 18+ — бот","загородный вечер 18+ бот","zagorodnyi-vecher-18-bot","Уют загородного вечера: романтика 18+ в тексте — без медиа.","Хотите камин, чай и мягкие слова? Попробуем.","Открыть 18+ чат в Telegram","Уют|Текст|Намёки","18+|загород|вечер|бот","Опишем вечер у камина?|Пара деликатных комплиментов?|Если что — остановимся.","Согласовывать тон|Паузы|Приватность","Не просить медиа|Не давить|Без грубости","Как это работает","Текстовые сцены с тёплой атмосферой.","Границы и безопасность","18+, без графики.","Идеи для 18+ беседы","Камин, пледы, признания.","Нужно подтверждать возраст?","Да, 18+.","Есть ли откровенный контент?","Нет, только текст.","Анонимность и безопасность?","Берегите данные.",""
"/chat/kvest-v-soobsheniyah-18-bot/","Квест в сообщениях 18+ — бот","квест в сообщениях 18+ бот","kvest-v-soobsheniyah-18-bot","Мини-квест 18+ в тексте: выбор ответов и мягкие намёки.","Хотите интерактив без медиа? Запускайте.","Открыть 18+ чат в Telegram","Интерактив|Намёки|Текст","18+|квест|бот|деликатно","Выберем маршрут сцены 18+?|Только текст и полутона — ок?|Если лишнее — стоп.","Согласовывать правила|Паузы|Приватность","Не просить медиа|Не давить|Без грубости","Как это работает","Выбор варианта ведёт к следующему шагу.","Границы и безопасность","Строго 18+, без графики.","Идеи для 18+ беседы","Свидание, прогулка, планы.","Нужно подтверждать возраст?","Да, 18+.","Есть ли откровенный контент?","Нет, текст.","Анонимность и безопасность?","Соблюдайте приватность.",""
