"url","title","keyword","slug","description","intro","cta","bullets","tags","examples","tips_do","tips_avoid","h2a_title","h2a_text","h2b_title","h2b_text","h2c_title","h2c_text","faq1_q","faq1_a","faq2_q","faq2_a","faq3_q","faq3_a","internal_links"
"/chat/fantaziya-na-zakaz-18-bot/","Фантазия на заказ 18+ — бот","фантазия на заказ 18+ бот","fantaziya-na-zakaz-18-bot","Описываете идею — получаете деликатный текст 18+ без подробностей и медиа.","Хотите свой сценарий? Договоримся о границах.","Открыть 18+ чат в Telegram","Индивидуально|Намёки|Текст","18+|фантазия|бот|деликатно","Сформулирую идею намёком — продолжишь?|Очень аккуратно и без деталей?|Если некомфортно — пауза.","Согласовывать рамки|Деликатность|Паузы","Не просить медиа|Не нарушать правила|Не давить","Как это работает","Бот развивает заданную текстом идею.","Границы и безопасность","Приватно, 18+, без графики.","Идеи для 18+ беседы","Роли, свидания, признания.","Нужно подтверждать возраст?","Да, 18+.","Есть ли откровенный контент?","Нет, только текст.","Анонимность и безопасность?","Берегите личные данные.",""
"/chat/meditaciya-para-18-bot/","Мягкая медитация для пары 18+ — бот","медитация для пары 18+ бот","meditaciya-para-18-bot","Спокойные 18+ слова для расслабления вдвоём — без медиа.","Хочется разрядки? Попробуйте мягкие формулировки.","Открыть 18+ чат в Telegram","Расслабление|Текст|Анонимно","18+|медитация|пара|бот","Пара успокаивающих фраз?|Деликатно и без подробностей?|Если что — остановимся.","Бережность|Паузы|Приватность","Не просить медиа|Не давить|Без грубости","Как это работает","Текст помогает настроиться на спокойный лад.","Границы и безопасность","18+, без графики.","Идеи для 18+ беседы","Романтика, забота, планы.","Нужно подтверждать возраст?","Да, 18+.","Есть ли откровенный контент?","Нет, текст.","Анонимность и безопасность?","Соблюдайте приватность.",""
"/chat/tishina-i-nameki-18-bot/","Тишина и намёки 18+ — бот","тишина и намёки 18+ бот","tishina-i-nameki-18-bot","Минимум слов, максимум подтекста: бережный 18+ формат без медиа.","Любите молчаливый стиль? Обмен короткими намёками.","Открыть 18+ чат в Telegram","Минимум слов|Намёки|Текст","18+|минимализм|бот|деликатно","Пару очень коротких реплик?|Полутона вместо описаний?|Если лишнее — стоп.","Согласовывать ритм|Паузы|Приватность","Не давить|Не просить медиа|Без грубости","Как это работает","Короткие фразы с ясными границами.","Границы и безопасность","Приватно, 18+, без графики.","Идеи для 18+ беседы","Взгляды, жесты в словах, сцены.","Нужно подтверждать возраст?","Да, 18+.","Есть ли откровенный контент?","Нет, текст.","Анонимность и безопасность?","Берегите данные.",""
"/chat/zapisochki-18-bot/","Записочки 18+ — бот","записочки 18+ бот","zapisochki-18-bot","Ролевой формат «записочки» 18+: короткие сообщения с намёками — без медиа.","Хотите обмениваться записками? Попробуем.","Открыть 18+ чат в Telegram","Короткие записки|Намёки|Текст","18+|записки|бот|деликатно","Оставлю записку с намёком — продолжишь?|Очень деликатно, без деталей?|Если что — пауза.","Согласовывать правила|Паузы|Приватность","Не просить медиа|Не давить|Без грубости","Как это работает","Цепочка коротких 18+ записок.","Границы и безопасность","18+, приватно, без графики.","Идеи для 18+ беседы","Комплименты, просьбы, сцены.","Нужно подтверждать возраст?","Да, 18+.","Есть ли откровенный контент?","Нет, только текст.","Анонимность и безопасность?","Соблюдайте приватность.",""
"/chat/uzhin-doma-18-bot/","Ужин дома 18+ — бот","ужин дома 18+ бот","uzhin-doma-18-bot","Домашний сценарий 18+: мягкие слова и романтика — без медиа.","Готовите уютный вечер? Возьмите деликатные реплики.","Открыть 18+ чат в Telegram","Домашний уют|Текст|Намёки","18+|ужин|дом|бот","Пара фраз к ужину?|Комплимент и намёк — ок?|Если лишнее — остановимся.","Согласовывать ожидания|Паузы|Приватность","Не просить медиа|Не давить|Без грубости","Как это работает","Сцены описываются только словами.","Границы и безопасность","18+, без графики.","Идеи для 18+ беседы","Кулинария, музыка, признания.","Нужно подтверждать возраст?","Да, 18+.","Есть ли откровенный контент?","Нет, текст.","Анонимность и безопасность?","Берегите личные данные.",""
"/chat/puteshestvie-vperedi-18-bot/","Путешествие впереди 18+ — бот","путешествие впереди 18+ бот","puteshestvie-vperedi-18-bot","Флирт и планы перед поездкой — только текст, без медиа.","Собираетесь в путь? Добавьте лёгкой романтики.","Открыть 18+ чат в Telegram","Планы|Текст|Намёки","18+|путешествие|бот|деликатно","Пара фраз перед поездкой?|Очень деликатно и без подробностей?|Если что — пауза.","Согласовывать тон|Паузы|Приватность","Не просить медиа|Не давить|Без грубости","Как это работает","Короткие 18+ подсказки для планов.","Границы и безопасность","Приватно, 18+, без графики.","Идеи для 18+ беседы","Маршрут, гостиница, свидание.","Нужно подтверждать возраст?","Да, 18+.","Есть ли откровенный контент?","Нет, текст.","Анонимность и безопасность?","Соблюдайте приватность.",""
"/chat/plan-na-noch-18-bot/","План на ночь 18+ — бот","план на ночь 18+ бот","plan-na-noch-18-bot","Сценарии для позднего 18+ чата — деликатно, без медиа.","Нужны идеи на ночь? Возьмите мягкие реплики.","Открыть 18+ чат в Telegram","Поздний ритм|Текст|Намёки","18+|ночь|сценарии|бот","Дай план на поздний диалог?|Очень аккуратно и спокойно?|Если некомфортно — стоп.","Согласовывать рамки|Паузы|Приватность","Не просить медиа|Не давить|Без грубости","Как это работает","Подсказки для ночной переписки 18+.","Границы и безопасность","18+, без графики.","Идеи для 18+ беседы","Свидание, признания, роли.","Нужно подтверждать возраст?","Да, 18+.","Есть ли откровенный контент?","Нет, только текст.","Анонимность и безопасность?","Берегите личное.",""
"/chat/lenivoe-voskresenie-18-bot/","Ленивая воскресная 18+ переписка — бот","ленивое воскресенье 18+ бот","lenivoe-voskresenie-18-bot","Неспешный 18+ диалог на выходных — без медиа и без спешки.","Хочется расслабиться? Пишите в своём темпе.","Открыть 18+ чат в Telegram","Неспешно|Текст|Намёки","18+|выходные|бот|деликатно","Пара тёплых фраз в воскресенье?|Медленно и мягко — ок?|Если что — пауза.","Согласовывать темп|Паузы|Приватность","Не давить|Не просить медиа|Без грубости","Как это работает","Ровный 18+ диалог в удобном ритме.","Границы и безопасность","Приватно, без графики.","Идеи для 18+ беседы","Планы, отдых, комплименты.","Нужно подтверждать возраст?","Да, 18+.","Есть ли откровенный контент?","Нет, текст.","Анонимность и безопасность?","Соблюдайте приватность.",""
"/chat/rasslablyayushchii-18-bot/","Расслабляющий 18+ бот","расслабляющий 18+ бот","rasslablyayushchii-18-bot","Мягкие 18+ тексты для снятия напряжения — без подробностей и медиа.","Хочется расслабиться словами? Попробуем бережно.","Открыть 18+ чат в Telegram","Успокаивающий тон|Текст|Намёки","18+|расслабление|бот|деликатно","Пару расслабляющих фраз?|Очень аккуратно и спокойно?|Если лишнее — стоп.","Бережность|Паузы|Приватность","Не просить медиа|Не давить|Без грубости","Как это работает","Небольшие 18+ тексты для разрядки.","Границы и безопасность","18+, без графики.","Идеи для 18+ беседы","Романтика, поддержка, роли.","Нужно подтверждать возраст?","Да, 18+.","Есть ли откровенный контент?","Нет, только текст.","Анонимность и безопасность?","Берегите данные.",""
"/chat/vybor-roli-18-bot/","Выбор роли 18+ — бот","выбор роли 18+ бот","vybor-roli-18-bot","Подбираем комфортные роли и рамки 18+ — без медиа.","Хотите сценарий под себя? Согласуем роли и тон.","Открыть 18+ чат в Telegram","Согласование ролей|Намёки|Текст","18+|роли|бот|деликатно","Обсудим роли и границы?|Выберем тон и темп?|Если что — остановимся.","Уточнять ожидания|Фиксировать рамки|Паузы","Не нарушать границы|Не просить медиа|Без давления","Как это работает","Короткие шаги: роль → тон → сцена.","Границы и безопасность","Строго 18+, приватно.","Идеи для 18+ беседы","Свидание, тайный поклонник, ретро.","Нужно подтверждать возраст?","Да, 18+.","Есть ли откровенный контент?","Нет, текст.","Анонимность и безопасность?","Соблюдайте приватность.",""
"/chat/na-ty-18-bot/","На «ты» 18+ — бот","на ты 18+ бот","na-ty-18-bot","Переключаемся на дружеское «ты» в 18+ тексте — без медиа.","Хочется свободнее? Делайте это деликатно.","Открыть 18+ чат в Telegram","Простой тон|Намёки|Текст","18+|на ты|флирт|бот","Перейдём на «ты» мягко?|Пара намёков без подробностей?|Если некомфортно — вернёмся назад.","Согласовывать формат|Паузы|Приватность","Не давить|Не просить медиа|Без грубости","Как это работает","Лёгкая смена обращения и стиля.","Границы и безопасность","18+, без графики.","Идеи для 18+ беседы","Комплименты, планы, роли.","Нужно подтверждать возраст?","Да, 18+.","Есть ли откровенный контент?","Нет, только текст.","Анонимность и безопасность?","Берегите личные данные.",""
"/chat/vne-zony-komforta-18-bot/","Вне зоны комфорта 18+ — мягко","вне зоны комфорта 18+ бот","vne-zony-komforta-18-bot","Осторожное расширение 18+ границ в тексте: маленькие шаги, без медиа.","Хочется попробовать новое? Делаем это бережно.","Открыть 18+ чат в Telegram","Маленькие шаги|Намёки|Текст","18+|эксперимент|бот|деликатно","Предложу идею, а ты скажи «да/нет»?|Очень аккуратно и без деталей?|Если некомфортно — стоп.","Согласовывать рамки|Фиксировать комфорт|Паузы","Не давить|Не просить медиа|Без грубости","Как это работает","Проверяем идеи короткими шагами.","Границы и безопасность","18+, приватно, с согласия.","Идеи для 18+ беседы","Новые роли, ритм, стили.","Нужно подтверждать возраст?","Да, 18+.","Есть ли откровенный контент?","Нет, текстовый формат.","Анонимность и безопасность?","Соблюдайте приватность.",""
