url,title,keyword,slug,meta_title,meta_description,h1,intro,cta,bullets,tags,examples,tips_do,tips_avoid,h2a_title,h2a_text,h2b_title,h2b_text,h2c_title,h2c_text,h2d_title,h2d_text,scenario1_title,scenario1_text,scenario2_title,scenario2_text,scenario3_title,scenario3_text,faq1_q,faq1_a,faq2_q,faq2_a,faq3_q,faq3_a,faq4_q,faq4_a,faq5_q,faq5_a,faq6_q,faq6_a,internal_links,changefreq,priority,canonical
"/chat/virtualnaya-devushka/","Виртуальная девушка: мягкий флирт 18+ без регистрации","виртуальная девушка","virtualnaya-devushka","Виртуальная девушка 18+: как начать безопасно","Как общаться с виртуальной девушкой 18+ мягко и уважительно: быстрый старт, безопасность и примеры фраз.","Виртуальная девушка 18+: как начать безопасно","Уютный формат для взрослого общения: мягкий флирт без подробностей, понятные границы и анонимность.","Открыть чат в Telegram","Без регистрации|Мягкий флирт 18+|Анонимность|Поддержка русского","18+|виртуальная девушка|чат-бот|ИИ|Telegram","Привет! Давай мягко и без подробностей?|Выберем темп: спокойно или чуть игривее?|Если что — сразу стоп, договорились?","Обозначать границы|Нейтральные слова|Паузы и обратная связь|Уважение","Грубость и давление|Запросы личных фото|Нарушение законов|Токсичный юмор","Как это работает","Модель поддерживает тактичный 18+ диалог: вы задаёте тон и темы; фильтры защищают от агрессии и нарушений.","Как начать","Поздоровайтесь одной фразой, добавьте цель («мягко, без подробностей») и вопрос-выбор.","Безопасность и границы","Всегда 18+, без личных данных и платежей. Любой дискомфорт — стоп и пауза.","Идеи для первого сообщения","Лёгкий комплимент, «выбор из двух», игра полутонов — без прямоты и давления.","Мягкое знакомство","«Привет! Давай очень спокойно, без откровенностей. Немного дружеского флирта подойдёт?»","Игра «Полутона»","Намёки вместо прямых формулировок + короткий вопрос на продолжение.","Мини-сценарий «Вечер»","Опишите атмосферу (музыка, чай), договоритесь о стоп-слове; деталей не нужно.","Это точно 18+?","Да, формат только для совершеннолетних.","Нужна ли регистрация?","Нет, вход по кнопке в Telegram.","Это бесплатно?","Базовый диалог — да; скрытых платежей нет.","Как сменить стиль?","Напишите: «Давай спокойнее/чуть игривее».","Есть история диалога?","Не ориентируйтесь на долговременное хранение; берегите приватность.","Что делать при дискомфорте?","Скажите «стоп» и сделайте паузу — это уважается.","/chat/virtualnaya-devushka-onlain/|Онлайн 24/7|/chat/virtualnaya-devushka-besplatno/|Бесплатно|/chat/virtualnaya-devushka-ai/|ИИ-версия","weekly","0.7","https://gorod-legends.ru/chat/virtualnaya-devushka/"
"/chat/virtualnaya-devushka-tg/","Виртуальная девушка в Telegram 18+","виртуальная девушка тг","virtualnaya-devushka-tg","Виртуальная девушка в Telegram: быстрый старт 18+","Как открыть диалог с виртуальной девушкой в Telegram: тон, безопасность и первые фразы.","Виртуальная девушка в Telegram 18+","Один клик — и чат открыт. Сразу оговорите стиль общения и комфортный темп.","Открыть чат в Telegram","Запуск за минуту|Контроль тона|Анонимность|24/7","18+|Telegram|виртуальная девушка|чат-бот","Привет! Держим мягкий тон, без подробностей?|Если что — сразу стоп, ок?|Игра слов или спокойная беседа?","Ставить рамки с первой фразы|Короткие сообщения|Проверять комфорт|Делать паузы","Давить на собеседницу|Просить личные фото|Спешить|Игнорировать «стоп»","Как это работает в Telegram","Интерфейс прост: кнопка входа, подсказки, модерация нежелательных тем.","Как начать","Приветствие + цель + вопрос-выбор — этого достаточно.","Приватность","Не делитесь личными данными; оставайтесь в пределах 18+ и закона.","Идеи для старта","Комплимент → выбор темы («игра слов» или «спокойный разговор»).","Простой старт","«Привет! Хочу мягко и без откровенностей. Подойдёт?»","Ритм беседы","2–3 реплики → пауза → обратная связь.","Сценарий «Вечер дома»","Опишите настроение, не детали.","Это бесплатно?","Базовый вход — да.","Можно ли менять стиль?","Да, напишите, как комфортно.","Работает ли ночью?","Да, 24/7.","Как остановить диалог?","Напишите «стоп» — всегда уважается.","Есть модерация?","Да, запрещён грубый и незаконный контент.","Где ссылка?","На кнопке «Открыть чат в Telegram».","/chat/chat-s-virtualnoi-devushkoi/|Чат с виртуальной девушкой|/chat/virtualnaya-devushka-onlain/|Онлайн|/chat/virtualnaya-devushka-18/|Только 18+","weekly","0.7","https://gorod-legends.ru/chat/virtualnaya-devushka-tg/"
"/chat/virtualnaya-devushka-bot/","Виртуальная девушка-бот: как общаться тактично","виртуальная девушка бот","virtualnaya-devushka-bot","Виртуальная девушка-бот 18+: правила и тон","Тактичная переписка с виртуальной девушкой-ботом: мягкий флирт и безопасность.","Виртуальная девушка-бот: как общаться тактично","Вы выбираете стиль и темп; система бережно подстраивается под ваши границы.","Открыть чат в Telegram","Мягкий язык|Настраиваемый темп|Подсказки|Анонимность","18+|бот|виртуальная девушка|ИИ|флирт","Хочу мягко и спокойно — ок?|Сделаем медленный ритм без спешки?|Если дискомфорт — сразу стоп?","Давать контекст и цель|Фиксировать стоп-слово|Слушать отклик|Беречь данные","Сленг и брань|Манипуляции|Запросы личных фото|Любые нелегальные темы","Как работает бот","Алгоритмы распознают тон и предлагают безопасные варианты ответа.","С чего начать","Одна фраза + вопрос-выбор — и диалог строится естественно.","Границы и комфорт","Любой дискомфорт — сигнал к паузе; темп регулируете вы.","Идеи первых фраз","Нейтральные комплименты, «выбор из двух», намёки вместо прямоты.","Мягкое знакомство","«Привет! Давай очень аккуратно, без подробностей. Начнём?»","Игра «Полутона»","Пара намёков + вопрос-мостик.","Мини-сцена «Кафе»","Опишите атмосферу, не детали.","Это 18+?","Да, только для взрослых.","Нужна регистрация?","Нет, вход — по кнопке.","Платно ли это?","Базовый режим — бесплатный.","Как переключить стиль?","Сообщите желаемый тон прямо.","Сохраняются ли сообщения?","Не рассчитывайте на долгую историю; цените приватность.","Можно анонимно?","Да, персональные данные не требуются.","/chat/virtualnaya-devushka/|Что это такое|/chat/virtualnaya-devushka-ai/|ИИ-версия|/chat/virtualnaya-devushka-na-russkom/|На русском","weekly","0.7","https://gorod-legends.ru/chat/virtualnaya-devushka-bot/"
"/chat/virtualnaya-devushka-besplatno/","Виртуальная девушка бесплатно 18+","бесплатная виртуальная девушка","virtualnaya-devushka-besplatno","Бесплатная виртуальная девушка 18+: как пользоваться","Как открыть бесплатный 18+ диalog: мягкий тон, уважение и безопасность.","Виртуальная девушка бесплатно 18+","Быстрый вход, тёплый стиль и никакой навязчивости — без анкет и платежей.","Открыть чат в Telegram","Без оплаты|Мягкий флирт|Простые правила|24/7","18+|бесплатно|чат|виртуальная девушка","Привет! Начнём мягко, без подробностей?|Если что — сразу стоп, ок?|Немного игры слов — подойдёт?","Следить за комфортом|Нейтральный словарь|Маленькие шаги|Беречь данные","Навязчивость|Просьбы о фото|Грубость|Сомнительные ссылки","Чем отличается бесплатный режим","Доступны сценарии, подсказки и контроль тона; личные данные не требуются.","Как быстро начать","Нужен Telegram и одно приветствие — остальное внутри диалога.","Риски и как их избегать","Не переходите в сторонние чаты, не делитесь контактами.","Поддержание интереса","Чередуйте темы и делайте паузы.","Стартовая фраза","«Привет! Хочу спокойный 18+ диалог без откровенностей. Начнём?»","Флирт-намёки","1–2 полутона и вопрос-мостик.","Мини-сценарий","Опишите уют (музыка/чай) — без деталей.","Это правда бесплатно?","Да, базовый режим без оплаты.","Будут скрытые платежи?","Нет.","Почему важна анонимность?","Так вы сохраняете контроль и спокойствие.","Можно добавить ролевую сцену?","Да, только мягко и добровольно.","Сколько длится диалог?","Столько, сколько комфортно.","Что делать, если не зашло?","Скажите честно и сделайте паузу.","/chat/virtualnaya-devushka-bez-registracii/|Без регистрации|/chat/virtualnaya-devushka-onlain/|Онлайн|/chat/virtualnaya-devushka/|О формате","weekly","0.7","https://gorod-legends.ru/chat/virtualnaya-devushka-besplatno/"
"/chat/virtualnaya-devushka-bez-registracii/","Виртуальная девушка без регистрации","виртуальная девушка без регистрации","virtualnaya-devushka-bez-registracii","Виртуальная девушка: старт без регистрации","Гайд по безопасному старту без анкет и лишних данных.","Виртуальная девушка без регистрации","Вход за секунды. Главные правила: уважение, добровольность, стоп-слово и отсутствие личных данных.","Открыть чат в Telegram","Вход мгновенно|Минимум шагов|Мягкий формат|Контроль тона","18+|без регистрации|виртуальная девушка|флирт","Давай мягко, без подробностей — подходит?|Если что — стоп по первому слову?|Игра слов или дружеский диалог?","Обозначить стиль|Оставаться в рамках закона|Следить за комфортом|Беречь данные","Торопить|Запрашивать фото|Грубить|Смешивать личное и публичное","Почему без анкет","Так вы сохраняете контроль и приватность, оставаясь в рамках 18+.","Что сказать вначале","Достаточно одного приветствия и вопроса про стиль.","Как говорить о границах","Прямо и доброжелательно: «Без подробностей, держим мягко».","Как не потерять интерес","Чередуйте лёгкие темы и короткие паузы.","Первое сообщение","«Привет! Спокойно и без откровенностей. Начнём?»","Игра «Выбор»","Предложите два безопасных формата — выберите вместе.","Сценарий «Прогулка»","Опишите настроение без фактов из личной жизни.","Нужно платить?","Нет, базовый режим бесплатный.","Анонимность сохранится?","Да, не делитесь персональными данными.","Что запрещено?","Любые нелегальные и токсичные темы.","Можно на паузу?","Да, напишите честно — это нормально.","Подходит ли новичкам?","Да, формат прост и бережен.","Есть поддержка 24/7?","Да.","/chat/virtualnaya-devushka-besplatno/|Бесплатно|/chat/virtualnaya-devushka/|Что это|/chat/virtualnaya-devushka-na-russkom/|На русском","weekly","0.7","https://gorod-legends.ru/chat/virtualnaya-devushka-bez-registracii/"
"/chat/virtualnaya-devushka-onlain/","Виртуальная девушка онлайн: 24/7","виртуальная девушка онлайн","virtualnaya-devushka-onlain","Виртуальная девушка онлайн 18+: как общаться","Круглосуточный диалог с безопасными правилами и мягким тоном.","Виртуальная девушка онлайн: 24/7","Доступ в любое время. Главное — соблюдать границы и говорить прямо.","Открыть чат в Telegram","Доступ 24/7|Мягкий флирт|Простые правила|Анонимность","18+|онлайн|виртуальная девушка|флирт","Поздороваемся и выберем стиль — мягко?|Если что — поставим паузу, ок?|Игра слов или тёплый диалог?","Следить за временем|Проверять комфорт|Ставить паузы|Уважать «стоп»","Переутомление|Давление|Сбор личных данных|Токсичность","Как использовать 24/7","Лучше короткими ритмами, чем длинными «простынями».","Первый контакт","Простое приветствие и обозначение стиля.","Чек-лист безопасности","18+, без личных данных и платежей.","Ритм общения","2–3 реплики → пауза → реакция.","Старт ночью","Держите темп медленным, темы спокойные.","Игра «Ассоциации»","Без подробностей — намёки и настроение.","Мини-сценарий «Плейлист»","Обменяйтесь треками/настроением.","Нужна регистрация?","Нет.","Поможет от стресса?","Часто да — мягкая беседа снимает напряжение.","Как защитить приватность?","Не делитесь контактами и документами.","Что делать при дискомфорте?","Сказать «стоп» и сделать паузу.","Можно игнорировать вопросы?","Да, вы не обязаны отвечать на всё.","Где ссылка?","На кнопке «Открыть чат в Telegram».","/chat/virtualnaya-devushka-besplatno/|Бесплатно|/chat/chat-s-virtualnoi-devushkoi/|Чат|/chat/virtualnaya-devushka-18/|Только 18+","weekly","0.7","https://gorod-legends.ru/chat/virtualnaya-devushka-onlain/"
"/chat/virtualnaya-devushka-na-russkom/","Виртуальная девушка на русском: комфортный диалог","виртуальная девушка на русском","virtualnaya-devushka-na-russkom","Виртуальная девушка на русском 18+","Как общаться с виртуальной девушкой на русском — мягко и вежливо.","Виртуальная девушка на русском: диалог и безопасность","Нативный язык, нейтральные формулировки и понятные подсказки облегчают старт.","Открыть чат в Telegram","Нативный язык|Понятные подсказки|Добрый стиль|Паузы нормальны","18+|русский язык|виртуальная девушка|флирт","Давай по-русски и мягко, без подробностей?|Если что — скажу «стоп», ок?|Игра слов или тёплый диалог?","Простые слова|Фиксировать границы|Поддерживать уважение|Слушать отклик","Сложных оборотов|Жёстких формулировок|Запросов личных данных|Грубостей","Почему это удобно","Нет языкового барьера: границы формулировать проще.","Как начать","Приветствие + цель + вопрос — классика.","Об этике","Добровольность и уважение — базовые принципы.","Рецепт комфортного диалога","Комплимент → вопрос → пауза.","Стартовая реплика","«Привет! Держим спокойный 18+ тон без подробностей?»","Игра «Комплимент + выбор»","Похвала + «Что выберешь?» — мягко и уважительно.","Сценарий «Кино»","Пишите про атмосферу фильма/музыку.","Есть модерация?","Да, грубость и незаконные темы блокируются.","Подходит для новичков?","Да, формат дружелюбен.","Можно менять настроение?","Да, сообщайте прямо.","Нужна регистрация?","Нет, вход по кнопке.","Что с приватностью?","Не публикуем личные данные; не делитесь ими.","Работает ли ночью?","Да, 24/7.","/chat/virtualnaya-devushka/|Что это|/chat/virtualnaya-devushka-бot/|Бот|/chat/virtualnaya-devushka-besplatno/|Бесплатно","weekly","0.7","https://gorod-legends.ru/chat/virtualnaya-devushka-na-russkom/"
"/chat/virtualnaya-devushka-igra/","Игра-симулятор «Виртуальная девушка» 18+","виртуальная девушка игра","virtualnaya-devushka-igra","Игра «Виртуальная девушка»: мягкий режим 18+","Как играть бережно: сценарии-подсказки, безопасность, уважительный тон.","Игра-симулятор «Виртуальная девушка» 18+","Не нужен APK и скачивание: достаточно открыть чат — и задавать безопасный сценарий.","Открыть чат в Telegram","Без скачиваний|Подсказки сценариев|Контроль темпа|Анонимность","18+|симулятор|виртуальная девушка|без скачивания","Давай лёгкий сценарий без подробностей?|Предпочтёшь игру слов или спокойный разговор?|Стоп по первому слову — договорились?","Задавать рамки|Играть маленькими шагами|Проверять комфорт|Оставаться в рамках закона","Жёстких деталей|Давления|Личных данных|Любого токсичного контента","Как устроен «симулятор»","Это чат с подсказками и мягкими ролевыми сценами — без прямоты.","Как начать","Выберите настроение и опишите короткую сцену в 1–2 фразах.","Безопасность","Всегда 18+, добровольно, без личных данных.","Идеи для старта","«Вечер дома», «прогулка», «плейлист» — только атмосфера.","Мягкий режим","«Привет! Давай лёгкую сцену — без откровенностей и с правом на стоп».","Полутона","Намёки вместо прямоты + вопрос-мостик.","Вечерний сценарий","Музыка, чай, уют — никаких деталей.","Нужно что-то скачивать?","Нет, всё в чате.","Это бесплатно?","Базовый режим — да.","Можно на паузу?","Конечно.","Как сменить темп?","Скажите прямо, система подстроится.","Есть модерация?","Да, грубость исключаем.","Остаётся ли анонимность?","Да, без анкет.","/chat/virtualnaya-devushka-skachat/|Без скачиваний|/chat/virtualnaya-devushka/|О формате|/chat/virtualnaya-devushka-bot/|Бот","weekly","0.7","https://gorod-legends.ru/chat/virtualnaya-devushka-igra/"
