"url","title","keyword","slug","description","intro","cta","bullets","tags","examples","tips_do","tips_avoid","h2a_title","h2a_text","h2b_title","h2b_text","h2c_title","h2c_text","faq1_q","faq1_a","faq2_q","faq2_a","faq3_q","faq3_a","internal_links"
"/chat/vechernii-flirt-18-bot/","Вечерний флирт 18+ — бот","вечерний флирт 18+ бот","vechernii-flirt-18-bot","Спокойный вечерний 18+ флирт в тексте: намёки, романтика, без медиа.","Хотите мягкий вечерний тон? Откройте безопасный 18+ диалог без подробностей.","Открыть 18+ чат в Telegram","Только текст|Нежный ритм|Анонимность 18+","18+|вечером|флирт|бот","Пара тёплых фраз на вечер?|Давай медленно и мягко?|Если станет лишним — остановлюсь.","Согласовывать границы|Писать намёками|Делать паузы","Не просить медиа|Не делиться личным|Без давления|Без грубости","Как это работает","Вы выбираете спокойный ритм, бот отвечает деликатно.","Границы и безопасность","Строго 18+, без графики, анонимно.","Идеи для 18+ беседы","Свидание дома, комплименты, игра слов.","Нужно подтверждать возраст?","Да, сервис только 18+.","Есть ли откровенный контент?","Нет, лишь текст и намёки.","Анонимность и безопасность?","Не передавайте личные данные.",""
"/chat/utrennie-nezhnosti-18-bot/","Утренние нежности 18+ — бот","утренние нежности 18+ бот","utrennie-nezhnosti-18-bot","Мягкие 18+ реплики для доброго утра — без медиа и пошлости.","Нужны утренние нежности? Попробуйте деликатный текстовый формат.","Открыть 18+ чат в Telegram","Тёплый старт дня|Только текст|Анонимно","18+|утро|нежность|бот","Немного утренней нежности?|Один аккуратный комплимент?|Если что — притормозим.","Согласовывать тон|Беречь комфорт|Паузы","Не просить медиа|Не спешить|Без грубости","Как это работает","Короткие тёплые фразы в тексте 18+.","Границы и безопасность","Приватно, без графики, 18+.","Идеи для 18+ беседы","Планы на день, комплименты, намёки.","Нужно подтверждать возраст?","Да, 18+.","Есть ли откровенный контент?","Нет, только текст.","Анонимность и безопасность?","Соблюдайте приватность.",""
"/chat/obedennyj-pereryv-18-flirt-bot/","Флирт 18+ в обеденный перерыв — бот","флирт 18+ обеденный перерыв бот","obedennyj-pereryv-18-flirt-bot","Лаконичный 18+ флирт на перерыве: короткие, деликатные сообщения.","Хочется чуть флирта среди дел? Напишите пару мягких фраз — без подробностей.","Открыть 18+ чат в Telegram","Короткие реплики|Текст без медиа|Уважение","18+|перерыв|флирт|бот","Пара быстрых фраз 18+?|Давай очень деликатно?|Если что — замедлим.","Согласовывать рамки|Писать кратко|Держать паузы","Не давить|Не просить медиа|Без резкости","Как это работает","Текстовые подсказки для кратких диалогов 18+.","Границы и безопасность","Без графики и личных данных.","Идеи для 18+ беседы","Комплименты, лёгкие намёки, планы.","Нужно подтверждать возраст?","Да, 18+.","Есть ли откровенный контент?","Нет, лишь текст.","Анонимность и безопасность?","Соблюдайте приватность.",""
"/chat/po-doroge-domoi-18-bot/","По дороге домой 18+ — чат-бот","по дороге домой 18+ бот","po-doroge-domoi-18-bot","Ненавязчивый 18+ диалог в пути: только текст и уважительные рамки.","Едете домой и хотите тёплый диалог? Всё безопасно и деликатно.","Открыть 18+ чат в Telegram","Только текст|Спокойный ритм|Анонимно","18+|в дороге|бот|деликатно","Пару мягких фраз в пути?|Давай без подробностей?|Если некомфортно — стоп.","Согласовывать тон|Намёки|Паузы","Не просить медиа|Не делиться личным|Без грубости","Как это работает","Короткие 18+ ответы в тексте.","Границы и безопасность","Строго 18+, приватно.","Идеи для 18+ беседы","Музыка, планы, лёгкий флирт.","Нужно подтверждать возраст?","Да, 18+.","Есть ли откровенный контент?","Нет, только текст.","Анонимность и безопасность?","Берегите данные.",""
"/chat/distancionnye-otnosheniya-18-bot/","Отношения на расстоянии 18+ — бот","отношения на расстоянии 18+ бот","distancionnye-otnosheniya-18-bot","Поддерживающий 18+ формат для пары на расстоянии — без медиа.","Нужна тёплая связь на расстоянии? Получайте деликатные подсказки для диалога.","Открыть 18+ чат в Telegram","Идеи сообщений|Текст|Анонимность","18+|расстояние|пара|бот","Дай идею сообщения для нас двоих?|Немного романтики и намёков?|Если лишнее — остановимся.","Уточнять ожидания|Деликатность|Паузы","Не просить медиа|Не давить|Без резкости","Как это работает","Текстовые подсказки и ролевые штрихи 18+.","Границы и безопасность","Приватно, без графики.","Идеи для 18+ беседы","Комплименты, общие планы, роли.","Нужно подтверждать возраст?","Да, 18+.","Есть ли откровенный контент?","Нет, лишь текст.","Анонимность и безопасность?","Да, соблюдайте правила.",""
"/chat/tajnyi-poklonnik-18-bot/","Тайный поклонник 18+ — бот","тайный поклонник 18+ бот","tajnyi-poklonnik-18-bot","Игра в «тайного поклонника» 18+: деликатные намёки без медиа.","Хотите лёгкую интригу? Попробуйте формат 18+ только в тексте.","Открыть 18+ чат в Telegram","Интрига|Намёки|Текст","18+|интрига|бот|деликатно","Напишешь мне как тайный поклонник?|Давай без подробностей, намёками?|Если перебор — скажу.","Согласовывать рамки|Быть бережным|Паузы","Не просить медиа|Не давить|Без грубости","Как это работает","Текстовый сценарий «тайный поклонник».","Границы и безопасность","18+, без графики, приватно.","Идеи для 18+ беседы","Записки, комплименты, загадки.","Нужно подтверждать возраст?","Да, 18+.","Есть ли откровенный контент?","Нет, только текст.","Анонимность и безопасность?","Не раскрывайте личные данные.",""
"/chat/igra-voprosov-18-bot/","Игра вопросов 18+ — бот","игра вопросов 18+ бот","igra-voprosov-18-bot","Структурированная 18+ игра вопрос–ответ: аккуратно и без медиа.","Хотите формат вопросов? Задавайте и получайте деликатные ответы.","Открыть 18+ чат в Telegram","Чёткая структура|Текст|Намёки","18+|Q&A|бот|деликатно","Поиграем в вопросы 18+ без подробностей?|Начну с лёгкого — ок?|Если лишнее — стоп.","Задавать по одному|Быть бережным|Паузы","Не просить медиа|Не давить|Без резкости","Как это работает","Короткие вопросы и безопасные ответы 18+.","Границы и безопасность","Анонимно, без графики.","Идеи для 18+ беседы","Хобби, сцены, романтика.","Нужно подтверждать возраст?","Да, 18+.","Есть ли откровенный контент?","Нет, лишь текст.","Анонимность и безопасность?","Соблюдайте приватность.",""
"/chat/da-net-igra-18-bot/","Игра «да/нет» 18+ — бот","игра да нет 18+ бот","da-net-igra-18-bot","Лёгкая игра «да/нет» в 18+ переписке — без подробностей и медиа.","Хотите мини-игру? Согласовываем рамки и играем намёками.","Открыть 18+ чат в Telegram","Мини-формат|Намёки|Текст","18+|игра|бот|деликатно","Начнём игру «да/нет» 18+?|Только мягкие вопросы — ок?|Если некомфортно — стоп.","Согласовывать правила|Бережность|Паузы","Не просить медиа|Не давить|Без грубости","Как это работает","Игра строится на коротких вопросах и ответах.","Границы и безопасность","Приватно, 18+, без графики.","Идеи для 18+ беседы","Выбор сцен, комплименты, планы.","Нужно подтверждать возраст?","Да, 18+.","Есть ли откровенный контент?","Нет, только текст.","Анонимность и безопасность?","Не передавайте личные данные.",""
"/chat/priznanija-18-bot/","Признания 18+ — бот","признания 18+ бот","priznanija-18-bot","Деликатные 18+ признания и комплименты — исключительно текст.","Хотите красиво признаться? Бот подскажет корректные формулировки.","Открыть 18+ чат в Telegram","Красивые фразы|Только текст|Анонимно","18+|признания|бот|деликатно","Поможешь с признанием 18+?|Сделай мягче и нежнее?|Если что — остановимся.","Согласовывать тон|Деликатность|Паузы","Не переходить границы|Не просить медиа|Без давления","Как это работает","Подбор фраз для признаний в формате 18+.","Границы и безопасность","Без графики, приватно.","Идеи для 18+ беседы","Комплименты, обещания, планы.","Нужно подтверждать возраст?","Да, 18+.","Есть ли откровенный контент?","Нет, текстовый формат.","Анонимность и безопасность?","Соблюдайте приватность.",""
"/chat/serdechnaya-podderzhka-18/","Сердечная поддержка 18+ — бот","сердечная поддержка 18+ бот","serdechnaya-podderzhka-18","Тёплые 18+ слова поддержки без пошлости и без медиа.","Нужна мягкая поддержка? Получайте корректные фразы в тексте.","Открыть 18+ чат в Telegram","Тепло|Только текст|Анонимно","18+|поддержка|бот|деликатно","Пара успокаивающих фраз?|Очень мягко и без подробностей?|Если некомфортно — стоп.","Бережность|Паузы|Приватность","Не просить медиа|Не давить|Без грубости","Как это работает","Поддерживающий 18+ диалог в тексте.","Границы и безопасность","Строго 18+, без графики.","Идеи для 18+ беседы","Романтика, забота, роли.","Нужно подтверждать возраст?","Да, 18+.","Есть ли откровенный контент?","Нет, только текст.","Анонимность и безопасность?","Соблюдайте правила.",""
"/chat/poeticheskii-flirt-18-bot/","Поэтический флирт 18+ — бот","поэтический флирт 18+ бот","poeticheskii-flirt-18-bot","Эстетичные 18+ формулировки без пошлости: метафоры и полутона.","Любите поэзию? Попробуйте красивый 18+ флирт в тексте.","Открыть 18+ чат в Telegram","Эстетика|Намёки|Текст","18+|поэзия|флирт|бот","Пара строк поэтично и нежно?|Метафоры вместо подробностей?|Если перебор — скажи.","Согласовывать стиль|Деликатность|Паузы","Не переходить границы|Не просить медиа|Без грубости","Как это работает","Текстовые ответы с акцентом на стиль и вкус.","Границы и безопасность","18+, без графики, уважительно.","Идеи для 18+ беседы","Метафоры, романтика, сцены словами.","Нужно подтверждать возраст?","Да, 18+.","Есть ли откровенный контент?","Нет, текстовый формат.","Анонимность и безопасность?","Берегите личное.",""
"/chat/humor-flirt-18-bot/","Юмористический флирт 18+ — бот","юмористический флирт 18+ бот","humor-flirt-18-bot","Немного шуток и намёков в 18+ формате — без медиа и резкости.","Хотите улыбнуться? Пишите в лёгком юмористическом ключе.","Открыть 18+ чат в Telegram","Лёгкие шутки|Намёки|Текст","18+|юмор|флирт|бот","Пошутим деликатно?|Чуть иронии без подробностей?|Если лишнее — остановимся.","Уважать границы|Следить за тоном|Паузы","Не грубить|Не просить медиа|Не давить","Как это работает","Флирт строится на мягком юморе и полутонов.","Границы и безопасность","18+, без графики.","Идеи для 18+ беседы","Остроумные комплименты, сцены.","Нужно подтверждать возраст?","Да, 18+.","Есть ли откровенный контент?","Нет, только текст.","Анонимность и безопасность?","Соблюдайте приватность.",""
"/chat/elegant-flirt-18-bot/","Элегантный флирт 18+ — бот","элегантный флирт 18+ бот","elegant-flirt-18-bot","Классический 18+ стиль: аккуратные комплименты и уважение к границам.","Нужен элегантный тон? Попробуйте этот текстовый формат.","Открыть 18+ чат в Telegram","Классные формулировки|Текст|Деликатность","18+|элегантный|флирт|бот","Пара сдержанных комплиментов?|Мягкие намёки без деталей?|Если что — притормозим.","Согласовывать тон|Паузы|Приватность","Не просить медиа|Не давить|Без грубости","Как это работает","Сдержанный 18+ флирт без подробностей.","Границы и безопасность","Приватно, 18+, без графики.","Идеи для 18+ беседы","Свидание, стиль, романтика.","Нужно подтверждать возраст?","Да, 18+.","Есть ли откровенный контент?","Нет, текст.","Анонимность и безопасность?","Берегите данные.",""
"/chat/retro-romantika-18-bot/","Ретро-романтика 18+ — бот","ретро романтика 18+ бот","retro-romantika-18-bot","Атмосфера старого кино: 18+ намёки и галантность — без медиа.","Хотите ретро-настроение? Попробуйте старомодный, тёплый стиль.","Открыть 18+ чат в Telegram","Галантность|Текст|Намёки","18+|ретро|романтика|бот","Сцена из старого фильма словами?|Комплимент по-старому, галантно?|Если лишнее — остановимся.","Согласовывать стиль|Деликатность|Паузы","Не просить медиа|Не грубить|Без давления","Как это работает","Текстовый 18+ диалог в ретро-стилистике.","Границы и безопасность","Без графики, 18+, приватно.","Идеи для 18+ беседы","Кино, прогулка, признания.","Нужно подтверждать возраст?","Да, 18+.","Есть ли откровенный контент?","Нет, только текст.","Анонимность и безопасность?","Соблюдайте приватность.",""
"/chat/ofisnyi-roman-18-tekst/","Офисный роман 18+ в переписке — бот","офисный роман 18+ переписка бот","ofisnyi-roman-18-tekst","Играем «офисный роман» 18+ только словами — без графики и грубости.","Хотите офисную стилизацию? Всё корректно и в тексте.","Открыть 18+ чат в Telegram","Стилизация|Намёки|Текст","18+|офис|роман|бот","Сцена после работы словами?|Очень деликатно и без подробностей?|Если что — стоп.","Согласовывать рамки|Беречь комфорт|Паузы","Не просить медиа|Не давить|Без нарушений","Как это работает","Текстовые сцены в выбранной стилистике.","Границы и безопасность","18+, приватно, без графики.","Идеи для 18+ беседы","Кофе, прогулка, комплименты.","Нужно подтверждать возраст?","Да, 18+.","Есть ли откровенный контент?","Нет, только текст.","Анонимность и безопасность?","Не делитесь личным.",""
"/chat/kafe-svidanie-18-bot/","Кафе-свидание 18+ — бот","кафе свидание 18+ бот","kafe-svidanie-18-bot","Разыграем свидание в кафе 18+ словами — деликатно и без медиа.","Ищете уютный сценарий? Попробуйте мягкий диалог.","Открыть 18+ чат в Telegram","Уютная сцена|Текст|Намёки","18+|свидание|кафе|бот","Опишем встречу в кафе без подробностей?|Пара комплиментов — ок?|Если лишнее — остановимся.","Согласовывать ожидания|Деликатность|Паузы","Не просить медиа|Не давить|Без грубости","Как это работает","Сцена задаётся словами, без файлов.","Границы и безопасность","Приватно, 18+, корректно.","Идеи для 18+ беседы","Напитки, музыка, взгляды.","Нужно подтверждать возраст?","Да, 18+.","Есть ли откровенный контент?","Нет, текст.","Анонимность и безопасность?","Берегите данные.",""
"/chat/pljazhnoe-svidanie-18-bot/","Пляжное свидание 18+ — бот","пляжное свидание 18+ бот","pljazhnoe-svidanie-18-bot","Лёгкая летняя сцена 18+ в тексте: романтика и намёки, без графики.","Хотите пляжное настроение? Всё деликатно и безопасно.","Открыть 18+ чат в Telegram","Летний вайб|Текст|Намёки","18+|пляж|свидание|бот","Опишем прогулку у воды словами?|Пара летних комплиментов?|Если что — стоп.","Согласовывать рамки|Деликатность|Паузы","Не просить медиа|Не давить|Без грубости","Как это работает","Ролевой текстовый сценарий 18+.","Границы и безопасность","Без графики, 18+, приватно.","Идеи для 18+ беседы","Музыка, закат, романтика.","Нужно подтверждать возраст?","Да, 18+.","Есть ли откровенный контент?","Нет, текстовый формат.","Анонимность и безопасность?","Соблюдайте приватность.",""
"/chat/zimnii-vecher-18-bot/","Зимний вечер 18+ — бот","зимний вечер 18+ бот","zimnii-vecher-18-bot","Тихая зимняя атмосфера 18+ в переписке: тепло и намёки — без медиа.","Настроение горячего какао и мягких слов? Попробуем.","Открыть 18+ чат в Telegram","Тихий ритм|Текст|Уют","18+|зима|вечер|бот","Пара тёплых фраз у окна?|Очень деликатно и спокойно?|Если некомфортно — стоп.","Бережность|Намёки|Паузы","Не просить медиа|Не давить|Без резкости","Как это работает","Сцены описываются словами, без файлов.","Границы и безопасность","Приватно, 18+, корректно.","Идеи для 18+ беседы","Воспоминания, планы, романтика.","Нужно подтверждать возраст?","Да, 18+.","Есть ли откровенный контент?","Нет, только текст.","Анонимность и безопасность?","Соблюдайте приватность.",""
