url,title,keyword,slug,meta_title,meta_description,h1,intro,cta,bullets,tags,examples,tips_do,tips_avoid,h2a_title,h2a_text,h2b_title,h2b_text,h2c_title,h2c_text,h2d_title,h2d_text,scenario1_title,scenario1_text,scenario2_title,scenario2_text,scenario3_title,scenario3_text,faq1_q,faq1_a,faq2_q,faq2_a,faq3_q,faq3_a,faq4_q,faq4_a,faq5_q,faq5_a,faq6_q,faq6_a,internal_links,changefreq,priority,canonical
"/chat/virtualnaya-devushka-skachat/","«Скачать виртуальную девушку?» Не нужно — откройте чат","виртуальная девушка скачать","virtualnaya-devushka-skachat","Виртуальная девушка без скачиваний","Почему скачивать ничего не надо: безопаснее открыть чат в Telegram.","Виртуальная девушка без скачиваний","APK и инсталляции не требуются — один клик и вы в безопасном чате с подсказками.","Открыть чат в Telegram","Быстрый доступ|Без APK|Безопасно|Анонимно","18+|без скачивания|Telegram|виртуальная девушка","Ищете APK? Проще открыть чат — без установок и рисков.|Давай мягко и без подробностей?|Если что — стоп и пауза, ок?","Выбирать официальный вход|Держать нейтральный тон|Проверять комфорт|Беречь данные","Сторонние APK|Сомнительные ссылки|Запросы платежей|Любую прямоту","Почему лучше без скачиваний","Официальный чат безопаснее: без вредоносных файлов и лишних разрешений.","Как начать","Откройте по кнопке и поздоровайтесь одной фразой.","Безопасность","Не делитесь контактами и документами.","Идеи для старта","Комплимент и вопрос-выбор — достаточно.","Мягкий старт","«Привет! Хочу спокойный диалог без откровенностей. Начнём?»","Игра слов","Пара намёков и вопрос на продолжение.","Мини-сцена","Опишите настроение, не подробности.","Это бесплатно?","Да, базовый режим без оплаты.","Нужна регистрация?","Нет.","Можно сменить стиль?","Да, напишите прямо.","Есть модерация?","Да, запрещены нелегальные темы.","Работает 24/7?","Да.","Где ссылка?","На кнопке «Открыть чат в Telegram».","/chat/virtualnaya-devushka-android/|Android|/chat/virtualnaya-devushka-pk/|ПК|/chat/virtualnaya-devushka-игра/|Симулятор","weekly","0.7","https://gorod-legends.ru/chat/virtualnaya-devushka-skachat/"
"/chat/virtualnaya-devushka-android/","Виртуальная девушка на Android: без APK","виртуальная девушка на андроид","virtualnaya-devushka-android","Виртуальная девушка на Android без скачиваний","Откройте чат в Telegram — это безопаснее, чем искать APK.","Виртуальная девушка на Android: без APK","Подсказки и сценарии доступны прямо в чате — без установки приложений.","Открыть чат в Telegram","Без APK|Быстрый доступ|Анонимность|24/7","18+|Android|виртуальная девушка|без скачивания","Ищете APK? Лучше открой чат — это безопаснее.|Давай мягко и без подробностей?|Стоп по первому слову — ок?","Выбирать официальный вход|Оставаться в рамках 18+|Делать паузы|Беречь данные","Сторонние загрузки|Запросы платежей|Давление|Токсичность","Почему без APK","Официальный чат исключает риски и лишние разрешения.","Как начать","Кнопка → приветствие → вопрос-выбор.","Приватность","Не делитесь личными контактами и документами.","Идеи сообщений","Комплимент + выбор, игра полутонов.","Старт-пример","«Привет! Спокойно и без откровенностей. Начнём?»","Игра «Полутона»","Намёки вместо прямоты.","Мини-сцена «Вечер»","Опишите атмосферу, не детали.","Платно ли это?","Базовый режим — бесплатный.","Нужна регистрация?","Нет.","Где ссылка?","Кнопка «Открыть чат в Telegram».","Можно игнорировать вопросы?","Да, в своём темпе.","Есть модерация?","Да.","Работает 24/7?","Да.","/chat/virtualnaya-devushka-skachat/|Без скачиваний|/chat/virtualnaya-devushka/|О формате|/chat/virtualnaya-devushka-onlain/|Онлайн","weekly","0.7","https://gorod-legends.ru/chat/virtualnaya-devushka-android/"
"/chat/virtualnaya-devushka-pk/","Виртуальная девушка на ПК: вход за минуту","виртуальная девушка на пк","virtualnaya-devushka-pk","Виртуальная девушка на ПК — без установки","Откройте чат в браузере/Telegram Desktop — ничего не ставить.","Виртуальная девушка на ПК: вход за минуту","Все сценарии и подсказки доступны онлайн — безопасно и без инсталляций.","Открыть чат в Telegram","Без установки|Через браузер или TDesktop|Анонимность|Подсказки","18+|ПК|виртуальная девушка|онлайн","Открой через браузер и поздоровайся одной фразой.|Давай мягко, без подробностей?|Если что — стоп и пауза?","Выбирать официальный вход|Короткие сообщения|Проверять комфорт|Соблюдать 18+","Сомнительные EXE|Просьбы об оплате|Грубость|Личные данные","Почему без установки","Онлайн-режим безопаснее и быстрее.","Как начать","Кнопка → приветствие → выбор темпа.","Безопасность","Данные и платежи не требуются.","Идеи для старта","Комплимент и вопрос-выбор — работает почти всегда.","Мягкий старт","«Привет! Хочу спокойный диалог».","Игра слов","Пара намёков и вопрос-мостик.","Мини-сцена «Кино»","Обсудите атмосферу, не подробности.","Это бесплатно?","Да.","Можно ночью?","Да, 24/7.","Как сменить тон?","Написать прямо — система подстроится.","Есть модерация?","Да.","Нужна регистрация?","Нет.","Где ссылка?","На кнопке «Открыть чат в Telegram».","/chat/virtualnaya-devushka/|Что это|/chat/virtualnaya-devushka-onlain/|Онлайн|/chat/chat-s-virtualnoi-devushkoi/|Чат","weekly","0.7","https://gorod-legends.ru/chat/virtualnaya-devushka-pk/"
"/chat/tvoya-virtualnaya-devushka/","Твоя виртуальная девушка 18+: бережный формат","твоя виртуальная девушка","tvoya-virtualnaya-devushka","Твоя виртуальная девушка: как общаться","Как построить тёплый 18+ диалог без прямоты: правила и подсказки.","Твоя виртуальная девушка 18+: бережный формат","Формат для мягкого флирта и дружеской переписки — без давления и грубости.","Открыть чат в Telegram","Мягкий тон|Анонимность|Подсказки|Контроль темпа","18+|виртуальная девушка|общение|флирт","Хочу очень мягко и без подробностей — ок?|Выберем медленный ритм?|Стоп по первому слову — договорились?","Давать контекст|Слушать отклик|Отмечать стоп-слово|Беречь данные","Жёсткий язык|Манипуляции|Личные фото|Нарушения закона","Что внутри","Подсказки, сценарии и регулировка тона — всё для комфортного ритма.","Первый шаг","Приветствие + цель + вопрос — и вы уже в диалоге.","Этика","Добровольность и уважение — базовые принципы.","Идеи для начала","Комплимент → выбор темы; без прямоты.","Мягкое знакомство","«Привет! Очень спокойно, без откровенностей. Начнём?»","Полутона","Намёки и вопрос-мостик.","Сценарий «Прогулка»","Опишите настроение без фактов из личной жизни.","Это 18+?","Да.","Нужна регистрация?","Нет.","Бесплатно?","Базовый режим — да.","Можно поменять темп?","Да, напишите прямо.","Есть модерация?","Да.","История диалога хранится?","Ориентируйтесь на приватность.","/chat/obschenie-s-virtualnoi-devushkoi/|Общение|/chat/chat-s-virtualnoi-devushkoi/|Чат|/chat/virtualnaya-devushka-18/|Только 18+","weekly","0.7","https://gorod-legends.ru/chat/tvoya-virtualnaya-devushka/"
"/chat/chat-s-virtualnoi-devushkoi/","Чат с виртуальной девушкой 18+","чат с виртуальной девушкой","chat-s-virtualnoi-devushkoi","Чат с виртуальной девушкой: безопасный старт","Как начать диалог и удерживать комфортный ритм 18+.","Чат с виртуальной девушкой 18+","Короткие фразы, вежливость и право на паузу — основа приятного общения.","Открыть чат в Telegram","Короткие сообщения|Право на паузу|Подсказки|Анонимность","18+|чат|виртуальная девушка|флирт","Поздороваемся и выберем стиль — мягко?|Если что — стоп, ок?|Игра слов или дружеский диалог?","Формулировать просто|Задавать выбор|Проверять комфорт|Ставить паузы","Расспросы личного|Давление|Грубость|Запретные темы","Как удерживать интерес","Ритм «шаг — пауза — обратная связь».","С чего начать","Приветствие + цель + вопрос — и точка опоры есть.","Безопасность","18+, без личных данных и платежей.","Идеи первых фраз","Комплимент, игра полутонов, вопрос-мостик.","Старт-пример","«Привет! Держим мягко и без подробностей?»","Игра «Полутона»","Пара намёков и вопрос на продолжение.","Мини-сцена «Вечер»","Опишите атмосферу — без деталей.","Есть ограничения?","Да: 18+ и закон.","Нужна регистрация?","Нет.","Сколько длится диалог?","Сколько комфортно.","Можно перейти на паузу?","Конечно.","Где ссылка?","На кнопке «Открыть чат в Telegram».","","","/chat/obschenie-s-virtualnoi-devushkoi/|Общение|/chat/virtualnaya-devushka-onlain/|Онлайн|/chat/virtualnaya-devushka/|О формате","weekly","0.7","https://gorod-legends.ru/chat/chat-s-virtualnoi-devushkoi/"
